{
  "deck_id": "demo",
  "title": "Kể chuyện bằng slide",
  "requested_slide_count": 15,
  "slides": [
    {
      "number": 1,
      "layout": "cover",
      "title": "KỂ CHUYỆN BẰNG SLIDE",
      "takeaway": "Từ nội dung thô đến bài thuyết trình mạch lạc, có hình ảnh và hiệu ứng có chủ đích.",
      "composition": "cover composition, title and subordinate blocks, consistent typographic grid",
      "visual": "bridge: retained subject or aligned diagram and label",
      "content_units": 0,
      "reveal_sequence": [],
      "morph_from_previous": false
    },
    {
      "number": 2,
      "layout": "cards",
      "title": "Ba tầng của một câu chuyện",
      "takeaway": "Người nghe cần hiểu được điều gì, theo thứ tự nào và tại sao.",
      "composition": "cards composition, title and subordinate blocks, consistent typographic grid",
      "visual": "none: retained subject or aligned diagram and label",
      "content_units": 3,
      "reveal_sequence": [
        "static",
        "click",
        "click"
      ],
      "morph_from_previous": false
    },
    {
      "number": 3,
      "layout": "split",
      "title": "Chuyển cảnh để nối ý tưởng",
      "takeaway": "Cùng một hình ảnh có thể đi từ ví dụ nhỏ thành chủ thể chính của slide sau.",
      "composition": "split composition, title and subordinate blocks, consistent typographic grid",
      "visual": "bridge: retained subject or aligned diagram and label",
      "content_units": 3,
      "reveal_sequence": [
        "auto",
        "click",
        "click"
      ],
      "morph_from_previous": true,
      "morph_reason": "The same verified bridge photo expands from a card in slide 2 into the lead illustration in slide 3."
    },
    {
      "number": 4,
      "layout": "diagram",
      "title": "Cấu trúc cần cân đối",
      "takeaway": "Một sơ đồ ít chữ, nhưng mọi cấp thông tin cần cùng một trục thị giác.",
      "composition": "diagram composition, title and subordinate blocks, consistent typographic grid",
      "visual": "none: retained subject or aligned diagram and label",
      "content_units": 6,
      "reveal_sequence": [
        "auto",
        "click",
        "click"
      ],
      "morph_from_previous": false
    },
    {
      "number": 5,
      "layout": "timeline",
      "title": "Nhịp trình bày theo từng chặng",
      "takeaway": "Các cột mốc hiện tuần tự, giữ đủ thời gian cho phần giải thích.",
      "composition": "timeline composition, title and subordinate blocks, consistent typographic grid",
      "visual": "none: retained subject or aligned diagram and label",
      "content_units": 3,
      "reveal_sequence": [
        "auto",
        "click",
        "click"
      ],
      "morph_from_previous": false
    },
    {
      "number": 6,
      "layout": "split",
      "title": "Bài thuyết trình không dừng ở PPTX",
      "takeaway": "Một phiên bản đáng tin phải có nguồn, ghi chú và bằng chứng kiểm thử.",
      "composition": "split composition, title and subordinate blocks, consistent typographic grid",
      "visual": "bridge: retained subject or aligned diagram and label",
      "content_units": 3,
      "reveal_sequence": [
        "auto",
        "auto",
        "click",
        "click"
      ],
      "morph_from_previous": false
    },
    {
      "number": 7,
      "layout": "cards",
      "title": "Ảnh phù hợp quan trọng hơn ảnh nhiều",
      "takeaway": "Chọn ảnh theo nội dung, giấy phép và bố cục, thay vì tìm đại một hình trông đẹp.",
      "composition": "cards composition, title and subordinate blocks, consistent typographic grid",
      "visual": "none: retained subject or aligned diagram and label",
      "content_units": 3,
      "reveal_sequence": [
        "auto",
        "click",
        "click"
      ],
      "morph_from_previous": false
    },
    {
      "number": 8,
      "layout": "split",
      "title": "Người nói kiểm soát các ý xuất hiện",
      "takeaway": "Slide đầu có đủ bối cảnh; từng luận điểm tiếp theo xuất hiện bằng click.",
      "composition": "split composition, title and subordinate blocks, consistent typographic grid",
      "visual": "none: retained subject or aligned diagram and label",
      "content_units": 3,
      "reveal_sequence": [
        "auto",
        "click",
        "click"
      ],
      "morph_from_previous": false
    },
    {
      "number": 9,
      "layout": "timeline",
      "title": "Một quy trình build có thể lặp lại",
      "takeaway": "CI chạy cùng một chuỗi thao tác trên mỗi lần cập nhật nội dung.",
      "composition": "timeline composition, title and subordinate blocks, consistent typographic grid",
      "visual": "none: retained subject or aligned diagram and label",
      "content_units": 3,
      "reveal_sequence": [
        "auto",
        "click",
        "click"
      ],
      "morph_from_previous": false
    },
    {
      "number": 10,
      "layout": "diagram",
      "title": "Căn giữa và chia nhóm là hai phép thử khác nhau",
      "takeaway": "Mọi phần trong sơ đồ phải cùng trục và cùng một thứ tự trình bày.",
      "composition": "diagram composition, title and subordinate blocks, consistent typographic grid",
      "visual": "none: retained subject or aligned diagram and label",
      "content_units": 6,
      "reveal_sequence": [
        "auto",
        "click",
        "click"
      ],
      "morph_from_previous": false
    },
    {
      "number": 11,
      "layout": "quote",
      "title": "Chuyển động phải có mục đích",
      "takeaway": "Dùng làm điểm nghỉ ngắn trước phần kết luận. Chỉ giữ lại animation làm rõ quan hệ nhân quả, đối chiếu hoặc sự chuyển tiế",
      "composition": "quote composition, title and subordinate blocks, consistent typographic grid",
      "visual": "none: retained subject or aligned diagram and label",
      "content_units": 0,
      "reveal_sequence": [],
      "morph_from_previous": false
    },
    {
      "number": 12,
      "layout": "comparison",
      "title": "Không được đánh đồng build xanh với bản trình chiếu đẹp",
      "takeaway": "Có ba bước kiểm chứng bổ sung ngoài việc scripts chạy thành công.",
      "composition": "comparison composition, title and subordinate blocks, consistent typographic grid",
      "visual": "none: retained subject or aligned diagram and label",
      "content_units": 2,
      "reveal_sequence": [
        "auto",
        "click"
      ],
      "morph_from_previous": false
    },
    {
      "number": 13,
      "layout": "comparison",
      "title": "Đúng kỹ thuật chưa đủ để đẹp",
      "takeaway": "Cùng một nội dung nhưng chất lượng hình thức quyết định khả năng tiếp nhận.",
      "composition": "comparison composition, title and subordinate blocks, consistent typographic grid",
      "visual": "none: retained subject or aligned diagram and label",
      "content_units": 2,
      "reveal_sequence": [
        "auto",
        "click"
      ],
      "morph_from_previous": false
    },
    {
      "number": 14,
      "layout": "summary",
      "title": "Ba nguyên tắc không thỏa hiệp",
      "takeaway": "Giữ cho bài trình bày rõ ràng trước khi nghĩ đến hiệu ứng.",
      "composition": "summary composition, title and subordinate blocks, consistent typographic grid",
      "visual": "none: retained subject or aligned diagram and label",
      "content_units": 3,
      "reveal_sequence": [
        "auto",
        "click",
        "click"
      ],
      "morph_from_previous": false
    },
    {
      "number": 15,
      "layout": "thanks",
      "title": "CẢM ƠN",
      "takeaway": "Thời gian để trao đổi, đặt câu hỏi và phản hồi.",
      "composition": "thanks composition, title and subordinate blocks, consistent typographic grid",
      "visual": "none: retained subject or aligned diagram and label",
      "content_units": 0,
      "reveal_sequence": [],
      "morph_from_previous": false,
      "closing_style": "plain"
    }
  ]
}
